{
  "name" : "Fall 2015",
  "slug" : "fall15",
  "first_date" : "2014-08-26",
  "start_time" : "20:00",
  "end_time" : "21:00",
  "location" : "Gates 4301",
  "ical_desc" : "A series of talks and workshops on some of the most useful tools for advanced users and developers led by the Carnegie Mellon University Computer Club.",
  "web_desc" : "<p>This year, we're talking about kitties!</p>",
  "web_suggest" : "<p>If you would like to request, propose, or volunteer a talk, join us on IRC or email your talk idea to operations@club.</p>",
  "categories" : [
    "Power Tools",
    "Retro",
    "The Power of Linux",
    "Bash Some Heads",
    "It's Dangerous to Go Alone, Take This"
  ],
  "talks" : [
    {
      "title" : "Linux Containers",
      "cat" : 3,
      "notes" : "containers.html",
      "desc" : "The new containerization technologies available in Linux are receiving a massive amount of hype. Learn why everyone's excited about Docker, and how you can use it yourself."
    },
    {
      "title" : "Advanced Bash",
      "cat" : 4,
      "notes" : "advbash.html",
      "desc" : "Most developers and sysadmins and devops spend a lot of time on the command line. Learn how to maximize your effectiveness with bash - it's got all the cool features you need!"
    },
    {
      "title" : "Bash Scripting",
      "cat" : 4,
      "notes" : "bashscript.html",
      "desc" : "Bash scripting is the classic sysadmin technique, but it's useful for developers and even casual users. Automate your computer and write simple yet powerful and useful programs, with bash scripting."
    },
    {
      "title" : "Debugging",
      "cat" : 5,
      "notes" : "debugging.html",
      "desc" : "Learn the best techniques for expunging those pesky bugs from your programs!"
    },
    {
      "title" : "System Exploitation",
      "cat" : 5,
      "notes" : "exploitation.html",
      "desc" : "Get a tutorial in how bad people and security researchers break your web app and make your life harder!"
    },
    {
      "title" : "(Thanksgiving Break)",
      "cat" : 0,
      "notes" : "",
      "desc" : ""
    },
    {
      "title" : "PGP and Cryptography",
      "cat" : 5,
      "notes" : "crypto.html",
      "desc" : "Learn to create a PGP private/public keypair and use it for encryption and identity verification."
    }
  ],
  "url" : "http://www.cmucc.org/talks",
  "sponsor" : {
    "name" : "Green Hills Software",
    "url" : "http://www.ghs.com",
    "desc" : "Green Hills make the world's highest performing compilers, most secure real-time operating systems, revolutionary debuggers, and virtualization solutions for embedded systems.",
    "logo" : "2013logo_light.svg",
    "logo_svg-gen_height_offset" : 48
  }
}
