{
  "name" : "Fall 2014",
  "slug" : "fall14",
  "first_date" : "2014-08-27",
  "start_time" : "20:00",
  "end_time" : "21:00",
  "location" : "Wean Hall 5415",
  "ical_desc" : "A series of talks and workshops on some of the most useful tools for advanced users and developers led by the Carnegie Mellon University Computer Club.",
  "web_desc" : "<p>DEVOPS!  Hippest of buzzwords, earner of thousands!  Learn to harness the immense power of devops for yourself, by coming to the Fall 2014 Computer Club Workshop/Talk Series.  We will tell you the tricks that will allow you to transcend the annoyances of administration and offenses of operations, and return to the elegant, pure simplicity of raw code!</p>",
  "web_suggest" : "<p>If you would like to request, propose, or volunteer a talk, join us on IRC or email your talk idea to operations@club.</p>",
  "categories" : [
    "Power Tools",
    "Retro",
    "The Power of Linux",
    "Bash Some Heads",
    "It's Dangerous to Go Alone, Take This"
  ],
  "talks" : [
    {
      "title" : "Power Computing at CMU",
      "cat" : 1,
      "notes" : "power-computing.html",
      "desc" : "CMU is the top computer science university in the world. So obviously there are some useful software tools here, available to you! Learn what they are and how to use them to get your work done faster and more efficiently."
    },
    {
      "title" : "Power Vim",
      "cat" : 1,
      "notes" : "power-vim.html",
      "desc" : "Attend this talk to learn how to efficiently use the most powerful editor on earth! Even if you use an inferior editor, come to this talk! You might find you'd prefer this one!"
    },
    {
      "title" : "Power Emacs",
      "cat" : 1,
      "notes" : "power-emacs.html",
      "desc" : "Attend this talk to learn how to efficiently use the most powerful editor on earth! Even if you use an inferior editor, come to this talk! You might find you'd prefer this one!"
    },
    {
      "title" : "Source Version Control with Git",
      "cat" : 1,
      "notes" : "power-git.html",
      "desc" : "Do you like having undo and redo available in your editor? Then you're sure to like having undo and redo available on the command line! In this talk, you'll learn about the ideas behind the source version control system Git, and how to use its immense power for your own aims."
    },
    {
      "title" : "Retro Platforms Overview",
      "cat" : 2,
      "notes" : "retro.html",
      "desc" : "Why do you still get asked to keep lines of code to 80 columns or less? What's that 'Terminal' thing on your Mac and why should you care? Is that funny looking 80s computer your parents have sitting in the garage worth messing with? Attend this talk for a crash course in the history of computing that will answer these questions and more!"
    },
    {
      "title" : "Installing Linux Workshop",
      "cat" : 3,
      "notes" : "linux.html",
      "desc" : "We'll walk you through installing Linux and getting started with it, both on your own hardware or a virtual machine. Come get access to the best, most direct development environment possible!"
    },
    {
      "title" : "Advanced Filesystems and RAID",
      "cat" : 3,
      "notes" : "filesystems.html",
      "desc" : "Learn about exciting new developments like btrfs, and the fantastic features they provide! Also a short segment about things like LVM and RAID."
    },
    {
      "title" : "System Management with systemd",
      "cat" : 3,
      "notes" : "systemd.html",
      "desc" : "systemd is the much-maligned project that is either upgrading or ruining the core of Linux, depending on who you ask. Learn in this talk about the exciting features systemd brings, and why there's no need to fear Lennart Poettering!"
    },
    {
      "title" : "Linux Containers",
      "cat" : 3,
      "notes" : "containers.html",
      "desc" : "The new containerization technologies available in Linux are receiving a massive amount of hype. Learn why everyone's excited about Docker, and how you can use it yourself."
    },
    {
      "title" : "Advanced Bash",
      "cat" : 4,
      "notes" : "advbash.html",
      "desc" : "Most developers and sysadmins and devops spend a lot of time on the command line. Learn how to maximize your effectiveness with bash - it's got all the cool features you need!"
    },
    {
      "title" : "Bash Scripting",
      "cat" : 4,
      "notes" : "bashscript.html",
      "desc" : "Bash scripting is the classic sysadmin technique, but it's useful for developers and even casual users. Automate your computer and write simple yet powerful and useful programs, with bash scripting."
    },
    {
      "title" : "Debugging",
      "cat" : 5,
      "notes" : "debugging.html",
      "desc" : "Learn the best techniques for expunging those pesky bugs from your programs!"
    },
    {
      "title" : "System Exploitation",
      "cat" : 5,
      "notes" : "exploitation.html",
      "desc" : "Get a tutorial in how bad people and security researchers break your web app and make your life harder!"
    },
    {
      "title" : "(Thanksgiving Break)",
      "cat" : 0,
      "notes" : "",
      "desc" : ""
    },
    {
      "title" : "PGP and Cryptography",
      "cat" : 5,
      "notes" : "crypto.html",
      "desc" : "Learn to create a PGP private/public keypair and use it for encryption and identity verification."
    }
  ],
  "url" : "http://www.cmucc.org/talks",
  "sponsor" : {
    "name" : "Green Hills Software",
    "url" : "http://www.ghs.com",
    "desc" : "Green Hills make the world's highest performing compiles, most secure real-time operating systems, revolutionary debuggers, and virtualization solutions for embedded systems.",
    "logo" : "2013logo_light.svg",
    "logo_svg-gen_height_offset" : 48
  }
}
